Cluster,GWAS genes,Cluster genes
0,PPM1K NPNT HHIP FAM13A,WDFY3 HERC5 INTU HSPA4L PGRMC2 CXCL3 HHIP PTPN13 LIN54 MGST2 ELOVL6 PARM1 INPP4B RAP1GDS1 USO1 SLC39A8 BANK1 CDKL2 ADH1B MFSD8 NDUFC1 NPNT COQ2 SMARCA5 NUDT9 SETD7 SYNPO2 PPM1K RNF150 PLA2G12A PLAC8 HADH HSD17B11 RASSF6 MMAA CASP6 BMP3 ENOPH1 CXCL2 DAPP1 LSM6 FAM13A GSTCD ANAPC10 ELMOD2 ADH1C MANBA SPARCL1 MAPK10 CXCL1 PDLIM5 PKD2 USP53 ANXA5 SCARB2
1,,CCNA2 C4orf33 SCLT1 PAPSS1 TBCK ANTXR2 ZNF330 HPSE METAP1 RCHY1 HERC6 BDH2 PDE5A ANKRD17 COX18 THAP9 C4orf36 UNC5C COPS4 SPP1 CXCL10 GYPE CXCL9 AIMP1 OSTC LARP7 PLK4 NAAA CNOT6L MRPL1 TMEM150C PRDM8 RPL34 TBC1D9 CXCL11 SPATA5
2,BTC,SEC31A SPRY1 MAD2L1 HPGDS UBE2D3 MRPS18C TIFA MAML3 CXCL5 FRAS1 PPBP ELF2 RASGEF1B ZNF827 TIGD2 HELQ OTUD4 PRSS12 METTL14 SNCA ANK2 SGMS2 BMP2K PF4 LARP1B CDS1 NFKB1 PAQR3 PPP3CA USP38 BTC BBS12 PCDH18 G3BP2 MTHFD2L
3,PPA2 NAP1L5 TET2,NAP1L5 GAR1 AP1AR THAP6 RAB33B PPA2 ALPK1 CAMK2D C4orf3 EXOSC9 BBS7 TET2 ABCE1 KLHL8 AFF1 SEC24B SHROOM3 SDAD1 HERC3 ARSJ ANXA3 DNAJB14 SCOC GAB1 SCD5 EIF4E EMCN SLC10A7 INTS12 CISD2 CCNI PRDM5 IL15
4,,MMRN1 GPRIN3 SEC24D ABCG2 CCNG2 DKK2 SMAD1 NUP54 ADH5 TNIP3 FGF2 FAT4 SMARCAD1 STBD1 NAA15 PRKG2 TSPAN5 CFI TRAM1L1 ANKRD50 CYP2U1
