Cluster,GWAS genes,Cluster genes
0,PPA2 NPNT TET2 PPM1K,HERC6 MMAA LSM6 RPL34 MAML3 MRPL1 TRAM1L1 BLTP1 ANKRD17 MFSD8 AFF1 NPNT SEPTIN7P14 SEPTIN11 FAM13A-AS1 SEC24B GAR1 PYURF SPATA5 ELF2 WDFY3-AS2 OTUD4 ADH5 ALPK1 H2AZ1 PPM1K GSTCD PLA2G12A SEC31A DNAJB14 NUP54 BMP2K ZGRF1 FLJ20021 SLC10A7 DAPP1 C4orf3 NDUFC1 TBCK WDFY3 CCNI PPA2 LARP7 BDH2 THAP9-AS1 BANK1 HERC5 NUDT9 CNOT6L PPP3CA TBC1D9 FRAS1 ENOPH1 ABHD18 LINC01088 LINC02615 HNRNPDL EXOSC9 HPGDS SCARB2 INTU TIFA MGST2 LIN54 CCNA2 TET2 PGRMC2 COX18 SDAD1 KLHL8 PCDH18 THAP6 RAB33B G3BP2 EMCN DKK2 ANAPC10 GTF2IP12 MAD2L1 PLK4 UBE2D3 SCOC ELMOD2 HADH USP38 COPS4 PRDM8
1,FAM13A HHIP NAP1L5 BTC,ARHGEF38 SLC9B2 HHIP ANK2 CASP6 SETD7 BTC ADH1B GPAT3 FAM13A SPARCL1 HHIP-AS1 PDE5A ANXA3 MAPK10 CFI FAM47E CXCL5 FAM241A LINC01091 CYP2U1 THAP9 CCSER1 TRMT10A ANKRD50 MMRN1 USP53 ZNF827 CXCL3 PTPN13 BMP3 SNHG8 PRSS12 ABCG2 CDKL2 SYNPO2 ARSJ RNF150 SLC39A8 PKD2 BBS12 OSTC FGF2 RASSF6 HSPA4L PARM1 ANTXR2 SEC24B-AS1 MTHFD2L SHROOM3 FAT4 NAP1L5 JADE1 SMARCA5 INPP4B SOWAHB PF4 PPBP ADH1C EIF4E IL15 SMAD1 GAB1 PDLIM5 UNC5C CDS1 TNIP3
2,,CCNG2 PRKG2 NFKB1 RAB33B-AS1 RASGEF1B CXCL8 LARP1B RAP1GDS1 CXCL1 TMEM150C TSPAN5 SMARCAD1 PRDM5 GYPE SEC24D USO1 CAMK2D SPRY1 ZNF330 NDNF AIMP1 ABCE1 SCD5 AREG CXCL2 PAPSS1 SGMS2 METAP1 PLAC8 C4orf36 SCOC-AS1 NOCT PAQR3 MRPS18C SPP1 ARHGAP24 TIGD2
3,,NAAA BBS7 STBD1 HPSE NAA15 ABRAXAS1 SNCA INTS12 CXCL10 RCHY1 CXCL9 UBE2D3-AS1 LEF1 MCUB SCLT1 HELQ CXCL11
4,,HNRNPD ENPEP CISD2 COQ2 ANXA5 HSD17B11 LAMTOR3 MANBA AP1AR LINC01094 GPRIN3
