Cluster,GWAS genes,Cluster genes
0,BTC NPNT HHIP,SEC31A SCLT1 ZNF330 HSPA4L BDH2 HHIP PTPN13 ALPK1 CAMK2D HPGDS ELOVL6 ADH5 INPP4B RAP1GDS1 RASGEF1B CDKL2 SLC39A8 BANK1 ZNF827 NDUFC1 NPNT COQ2 SHROOM3 NUDT9 GYPE PRSS12 SYNPO2 GPRIN3 HNRNPD RNF150 ANXA3 PLAC8 HSD17B11 MMAA SCD5 RASSF6 BMP2K CDS1 DAPP1 MRPL1 GSTCD TMEM150C USP38 PRKG2 ADH1C MANBA BTC BBS12 MAPK10 CXCL1 PDLIM5 USP53 ANXA5
1,PPA2 TET2,CCNA2 GAR1 HERC5 HPSE METAP1 INTU RCHY1 MAD2L1 HERC6 PPA2 MGST2 PARM1 MRPS18C TET2 COX18 CFI ELF2 TRAM1L1 UNC5C COPS4 AFF1 SEC24B TIGD2 SPP1 OTUD4 SDAD1 AIMP1 ARHGAP24 PLA2G12A SCOC CASP6 ENOPH1 EIF4E LARP7 PLK4 OSTC CNOT6L LSM6 INTS12 SLC10A7 CISD2 NUP54 ANAPC10 CCNI PRDM5 TSPAN5 ELMOD2 TBC1D9 SPATA5 G3BP2 SCARB2
2,NAP1L5 FAM13A,C4orf33 TBCK NAP1L5 ANTXR2 AP1AR THAP6 WDFY3 RAB33B PGRMC2 ANKRD17 CXCL3 CCNG2 LIN54 UBE2D3 EXOSC9 SMAD1 BBS7 TIFA FRAS1 USO1 THAP9 KLHL8 STBD1 NAA15 CYP2U1 MFSD8 HELQ SMARCA5 SETD7 HERC3 METTL14 SEC24D SNCA DNAJB14 ANK2 GAB1 SGMS2 ABCG2 LARP1B CXCL2 NFKB1 FAM13A PAQR3 SMARCAD1 PKD2 PCDH18 IL15 MTHFD2L
3,,MMRN1 ARSJ SPRY1 PDE5A HADH PF4 DKK2 BMP3 EMCN CXCL5 PPBP PRDM8 ENPEP FGF2 FAT4 RPL34 SPARCL1 ANKRD50 ADH1B LEF1
4,PPM1K,MAML3 PAPSS1 PPP3CA ABCE1 PPM1K TNIP3 C4orf3
