Cluster,GWAS genes,Cluster genes
0,PPA2 PPM1K,HERC6 HPSE NAA15 HERC5 TBC1D9 SNCA PRDM8 HNRNPDL SEC24B CISD2 SCARB2 GAR1 PARM1 ANTXR2 WDFY3-AS2 PGRMC2 COX18 NAAA MTHFD2L PPM1K RAB33B SMARCA5 ANAPC10 LINC01091 ADH1C HNRNPD WDFY3 HADH CCNI MCUB PPA2 LARP7 SCLT1 ARHGAP24
1,NPNT BTC,ANK2 SLC9B2 BMP3 SETD7 INTS12 ABCG2 BTC LARP1B SYNPO2 RNF150 LINC01088 AFF1 NPNT PKD2 SPARCL1 PDE5A HSPA4L GYPE ANXA3 FAT4 JADE1 INPP4B FAM241A NDNF DKK2 SMAD1 METAP1 ANKRD50 PDLIM5 UNC5C MMRN1 USP53
2,NAP1L5,CFI CCNG2 CXCL3 MAML3 SPRY1 ZNF330 NAP1L5 CXCL8 RASGEF1B ENOPH1 CXCL5 PF4 AIMP1 DNAJB14 PPBP AREG CXCL2 CXCL1 FLJ20021 SGMS2 CAMK2D ALPK1 GAB1 LIN54 NOCT BDH2 AP1AR COPS4 KLHL8 PCDH18
3,FAM13A,STBD1 RPL34 SHROOM3 NFKB1 CNOT6L ABRAXAS1 G3BP2 SOWAHB ARSJ ABCE1 LINC02615 ADH1B EIF4E MAD2L1 GPAT3 BBS12 FAM13A PLK4 UBE2D3 FGF2 SCOC NDUFC1 TIFA CCNA2 SDAD1 USP38 OTUD4 H2AZ1 TNIP3
4,HHIP,ARHGEF38 HHIP MAPK10 CASP6 PRKG2 PTPN13 FAM47E NUDT9 ANXA5 PRSS12 CDKL2 RAP1GDS1 GTF2IP12 SEPTIN7P14 SLC39A8 PAPSS1 SEPTIN11 THAP9 C4orf3 TRMT10A PRDM5 RASSF6 PYURF HSD17B11 HHIP-AS1 CDS1 PAQR3 ZNF827
5,TET2,THAP6 PPP3CA FRAS1 TRAM1L1 BLTP1 SEC31A ABHD18 MFSD8 NUP54 ZGRF1 OSTC FAM13A-AS1 DAPP1 SMARCAD1 INTU ELMOD2 ELF2 SEC24D THAP9-AS1 USO1 TET2 BANK1 ADH5
6,,CYP2U1 COQ2 MANBA PLAC8 MGST2 EMCN SCD5 LINC01094 GPRIN3 TMEM150C
7,,IL15 CXCL9 LSM6 HPGDS BMP2K MRPL1 LEF1
