Cluster,GWAS genes,Cluster genes
0,HHIP NPNT,ARHGEF38 SLC9B2 HHIP PRKG2 ANK2 PTPN13 NUDT9 PPP3CA FRAS1 ABCG2 INTS12 CDKL2 PRDM8 ENOPH1 RNF150 LINC01088 NPNT SLC39A8 PKD2 SEPTIN11 SPARCL1 SEC24B FGF2 SCARB2 PRDM5 HHIP-AS1 PDE5A PYURF GYPE USO1 HERC3 ANXA3 COX18 C4orf33 CFI MMRN1 PLA2G12A INPP4B SMARCA5 SCD5 DKK2 FAM241A NDNF AREG EIF4E IL15 RCHY1 FLJ20021 SMAD1 C4orf3 SCOC GAB1 ELMOD2 SCOC-AS1 UNC5C BDH2 BANK1 USP53 ARHGAP24
1,TET2 PPM1K PPA2,BBS7 LSM6 RPL34 MAML3 BMP3 SNHG8 SETD7 RAB33B-AS1 BLTP1 ANKRD17 LARP1B SYNPO2 ABHD18 MFSD8 SEPTIN7P14 TMEM150C HNRNPDL BBS12 OSTC EXOSC9 UBE2D3-AS1 FAM13A-AS1 INTU MGST2 SPATA5 LIN54 ELF2 SEC24D ANTXR2 WDFY3-AS2 TET2 ADH5 ALPK1 PGRMC2 SEC24B-AS1 NAAA PPM1K THAP6 GSTCD FAT4 ANXA5 ZNF330 SEC31A NUP54 GTF2IP12 ZGRF1 CYP2U1 NDUFC1 WDFY3 CCNI PPA2 LARP7 THAP9-AS1 SCLT1
2,FAM13A BTC,HERC6 STBD1 HERC5 CNOT6L PRSS12 BTC TRAM1L1 ARSJ LINC02615 AFF1 LINC01094 ADH1B FAM13A TSPAN5 RASSF6 TIFA MANBA HSPA4L GPRIN3 OTUD4 PCDH18 METTL14 MAPK10 FAM47E SHROOM3 COQ2 G3BP2 JADE1 SOWAHB DNAJB14 LINC01091 ADH1C PAPSS1 UBE2D3 CCSER1 SGMS2 DAPP1 TBCK PLAC8 LEF1 ANKRD50 HADH MCUB CDS1 AP1AR USP38 COPS4
3,NAP1L5,MMAA CASP6 HPSE CCNG2 CXCL3 NAA15 NFKB1 TBC1D9 SNCA MRPL1 CXCL8 RASGEF1B CXCL10 CXCL1 CXCL9 HPGDS CISD2 SMARCAD1 GAR1 LAMTOR3 H2AZ1 MTHFD2L SPRY1 NAP1L5 EMCN ABCE1 AIMP1 ANAPC10 CXCL2 BMP2K HNRNPD SLC10A7 TRMT10A C4orf36 NOCT PAQR3 MRPS18C SPP1 CXCL11 TIGD2
4,,ABRAXAS1 RAB33B CXCL5 PF4 PPBP RAP1GDS1 GPAT3 MAD2L1 THAP9 PLK4 NUDT6 TNIP3 METAP1 HSD17B11 PDLIM5 CCNA2 PARM1 HELQ CAMK2D KLHL8 SDAD1 ZNF827
