Cluster,GWAS genes,Cluster genes
0,FAM13A HHIP NPNT BTC,ARHGEF38 SLC9B2 HHIP STBD1 PTPN13 BMP3 SETD7 RAB33B-AS1 INTS12 PRSS12 BTC CDKL2 LINC01088 NPNT ADH1B SLC39A8 GPAT3 FAM13A OSTC HPGDS FGF2 TSPAN5 HHIP-AS1 RASSF6 HSPA4L CAMK2D ALPK1 COX18 MAPK10 CFI FAM47E SPRY1 INPP4B SOWAHB DNAJB14 ARHGAP24 LINC01091 EIF4E ADH1C PAPSS1 RCHY1 IL15 METAP1 GAB1 UNC5C CDS1 BANK1 USP53 PRDM8
1,NAP1L5,CCNG2 CXCL3 PRKG2 MAML3 NFKB1 CNOT6L PPP3CA CXCL8 TRAM1L1 ARSJ AFF1 CXCL1 TNIP3 SEC24B SMARCAD1 SPATA5 GYPE PARM1 USO1 KLHL8 PCDH18 METTL14 SHROOM3 FAT4 NAP1L5 G3BP2 JADE1 CXCL5 FAM241A SMARCA5 NDNF PF4 SCD5 PPBP AREG CXCL2 UBE2D3 SMAD1 SGMS2 ELMOD2 HSD17B11 ANKRD50 USP38 NOCT SCLT1 PAQR3 TIGD2 SPP1 ZNF827
2,TET2 PPM1K,LSM6 RPL34 HERC5 FRAS1 ENOPH1 ANKRD17 BLTP1 LARP1B ABHD18 MFSD8 SEPTIN7P14 HNRNPDL BBS12 SEPTIN11 EXOSC9 FAM13A-AS1 ENPEP CISD2 INTU PRDM5 GAR1 LAMTOR3 ELF2 TET2 WDFY3-AS2 ADH5 PGRMC2 OTUD4 MTHFD2L PPM1K ABRAXAS1 ANXA5 ZNF330 EMCN NUP54 GTF2IP12 ZGRF1 CYP2U1 HNRNPD C4orf3 TRMT10A NDUFC1 TBCK PLAC8 WDFY3 HADH CCNI LARP7 THAP9-AS1
3,,ANK2 GSTCD ABCG2 PLA2G12A SYNPO2 RNF150 LINC02615 RAP1GDS1 TMEM150C MAD2L1 PKD2 FLJ20021 THAP9 PLK4 SPARCL1 SCOC SCARB2 PDE5A PDLIM5 MGST2 LIN54 CCNA2 SEC24D BDH2 ANTXR2 HELQ ANXA3 SEC24B-AS1
4,,HERC6 MMAA C4orf33 HPSE NUDT9 TBC1D9 SNCA COQ2 THAP6 RASGEF1B MRPL1 SEC31A DKK2 LINC01094 BMP2K DAPP1 PYURF MANBA GPRIN3 C4orf36 SCOC-AS1 MCUB TIFA AP1AR MMRN1 COPS4
5,,NAAA CXCL9 SLC10A7 CCSER1 NAA15 SNHG8 CXCL10 LEF1 H2AZ1 AIMP1 ABCE1 CXCL11 MRPS18C SDAD1
