Cluster,GWAS genes,Cluster genes
0,BTC NPNT HHIP,SEC31A SCLT1 ZNF330 HPSE SPRY1 BDH2 HHIP CAMK2D HPGDS ELOVL6 SMAD1 ADH5 INPP4B KLHL8 ELF2 CDKL2 SLC39A8 AFF1 ZNF827 ADH1B NDUFC1 NPNT COQ2 SHROOM3 NUDT9 MMRN1 GYPE PRSS12 SYNPO2 GPRIN3 HNRNPD RNF150 ANXA3 ANK2 PLAC8 SGMS2 HSD17B11 SCD5 BMP2K CDS1 DAPP1 CNOT6L MRPL1 TMEM150C USP38 PRKG2 ADH1C BTC BBS12 CXCL1 PDLIM5 SPATA5 USP53
1,PPA2 TET2,THAP6 HERC5 METAP1 INTU RCHY1 HSPA4L HERC6 PPA2 LIN54 MGST2 EXOSC9 MRPS18C TIFA TET2 RAP1GDS1 COX18 THAP9 USO1 STBD1 TRAM1L1 BANK1 COPS4 MFSD8 TIGD2 HELQ OTUD4 SDAD1 METTL14 PLA2G12A DNAJB14 RASSF6 CASP6 MMAA LSM6 GSTCD SLC10A7 INTS12 ANAPC10 CISD2 PRDM8 SMARCAD1 PRDM5 TSPAN5 ELMOD2 MAPK10 IL15
2,,CCNA2 C4orf33 TBCK ANTXR2 AP1AR WDFY3 RAB33B MAD2L1 PGRMC2 ANKRD17 PDE5A CCNG2 CXCL3 ALPK1 C4orf3 UBE2D3 ABCE1 RASGEF1B UNC5C SEC24B SMARCA5 SETD7 HERC3 AIMP1 ARHGAP24 SEC24D SNCA ABCG2 GAB1 SCOC PCDH18 ENOPH1 LARP1B OSTC CXCL2 NFKB1 PLK4 NUP54 CCNI PKD2 CYP2U1 G3BP2 MTHFD2L
3,NAP1L5,GAR1 PAPSS1 NAP1L5 ARSJ HADH PTPN13 DKK2 BMP3 LARP7 PARM1 EMCN PPP3CA FRAS1 ENPEP FGF2 FAT4 TNIP3 RPL34 SPARCL1 ANKRD50 LEF1 SPP1
4,PPM1K,BBS7 PAQR3 MAML3 PPM1K NAA15 CFI TBC1D9 MANBA EIF4E
5,FAM13A,CXCL10 ANXA5 CXCL11 CXCL9 NAAA FAM13A SCARB2
