Cluster,GWAS genes,Cluster genes
0,BTC NAP1L5 HHIP NPNT,NAP1L5 TBCK HERC5 HERC6 HSPA4L PDE5A HHIP ALPK1 HPGDS MRPS18C FRAS1 INPP4B ENPEP SLC39A8 BANK1 UNC5C TIGD2 NPNT SHROOM3 MMRN1 GYPE SYNPO2 RNF150 ANXA3 GAB1 ANK2 SGMS2 HSD17B11 DAPP1 EMCN SLC10A7 TNIP3 PRDM5 PRKG2 BTC BBS12 PKD2 PDLIM5 PCDH18 MTHFD2L
1,TET2,GAR1 PAPSS1 WDFY3 ZNF330 INTU CCNG2 PTPN13 CAMK2D PARM1 TET2 ADH5 COX18 KLHL8 CFI CDKL2 COPS4 AFF1 SEC24B PRSS12 HERC3 SEC24D PLA2G12A PLAC8 SCD5 MMAA BMP3 CDS1 CNOT6L TMEM150C CISD2 FAT4 RPL34 ADH1C MAPK10 CYP2U1 ANXA5
2,PPA2,SEC31A RCHY1 BDH2 PPA2 C4orf3 ELOVL6 UBE2D3 TIFA ABCE1 USO1 ZNF827 NDUFC1 HELQ COQ2 CXCL10 OTUD4 NUDT9 CXCL9 METTL14 GPRIN3 DNAJB14 HADH CASP6 DKK2 ENOPH1 OSTC NAAA LSM6 INTS12 PPP3CA ANAPC10 CCNI USP38 CXCL11 G3BP2
3,,SMARCA5 THAP6 RAB33B CXCL3 RASSF6 LARP1B CXCL2 NFKB1 CXCL1 GSTCD EXOSC9 PAQR3 PRDM8 RAP1GDS1 THAP9 STBD1 NAA15 ELF2 TSPAN5 TRAM1L1 ELMOD2 RASGEF1B MANBA ADH1B MFSD8 SPATA5 USP53 IL15
4,FAM13A,CCNA2 ANTXR2 ARSJ SPRY1 HPSE SNCA MAD2L1 ABCG2 BMP2K PLK4 FAM13A SMAD1 FGF2 SPARCL1 ANKRD50 SPP1 SCARB2
5,,SDAD1 C4orf33 SCLT1 SETD7 AP1AR METAP1 AIMP1 ARHGAP24 PGRMC2 ANKRD17 SCOC EIF4E LARP7 NUP54 C4orf36 LEF1
6,PPM1K,BBS7 MAML3 CXCL5 PPBP PPM1K SMARCAD1 PF4 LIN54 MGST2
