Cluster,GWAS genes,Cluster genes
0,BTC PPM1K NAP1L5,SEC31A NAP1L5 PAPSS1 ANTXR2 THAP6 INTU HSPA4L HERC6 CCNG2 ALPK1 LIN54 MGST2 C4orf3 EXOSC9 MAML3 ABCE1 COX18 USO1 TIGD2 USP53 SHROOM3 OTUD4 SMARCA5 PRSS12 SETD7 PPM1K SEC24D ANK2 PLAC8 LARP1B MRPL1 NAAA LSM6 PPP3CA CISD2 NUP54 PRDM8 CCNI ADH1C BTC BBS12 MAPK10 PDLIM5 CYP2U1
1,NPNT HHIP TET2,WDFY3 PGRMC2 ANKRD17 BDH2 HHIP PTPN13 CAMK2D HPGDS PARM1 UBE2D3 MRPS18C FRAS1 TET2 ADH5 INPP4B NAA15 TRAM1L1 CDKL2 BANK1 UNC5C SLC39A8 AFF1 LEF1 NPNT SPP1 NUDT9 GYPE SYNPO2 AIMP1 SNCA ANXA3 PLA2G12A SGMS2 BMP2K DAPP1 CNOT6L SLC10A7 PKD2 MTHFD2L
2,PPA2,C4orf33 GAR1 METAP1 RAB33B PPA2 RAP1GDS1 THAP9 RASGEF1B COPS4 ADH1B MFSD8 SEC24B COQ2 CXCL10 SDAD1 MMRN1 CXCL9 GPRIN3 ARHGAP24 HADH RASSF6 ENOPH1 DKK2 EIF4E OSTC INTS12 ANAPC10 FAT4 FGF2 USP38 SMARCAD1 SPARCL1 TBC1D9 ELMOD2 CXCL11 MANBA SPATA5 ANXA5
3,,CCNA2 AP1AR ARSJ HERC5 MAD2L1 CXCL3 SCD5 PF4 CXCL2 GSTCD SMAD1 EMCN TIFA CXCL5 PPBP PRDM5 TSPAN5 PRKG2 RPL34 ANKRD50 CXCL1 PCDH18 IL15 G3BP2
4,FAM13A,BBS7 PAQR3 LARP7 TBCK SCLT1 TMEM150C ZNF330 SPRY1 ENPEP TNIP3 RCHY1 CFI FAM13A SCOC HSD17B11 HELQ NFKB1 ELOVL6
5,,HERC3 METTL14 HPSE RNF150 PDE5A ABCG2 DNAJB14 GAB1 MMAA CASP6 CDS1 PLK4 KLHL8 STBD1 ELF2 ZNF827 NDUFC1 SCARB2
