Cluster,GWAS genes,Cluster genes
0,NPNT HHIP FAM13A,ANTXR2 HERC5 SPRY1 HSPA4L BDH2 HHIP PTPN13 EXOSC9 PARM1 MAML3 INPP4B CDKL2 SLC39A8 ZNF827 SPP1 HNRNPD ARHGAP24 ANXA3 GAB1 RASSF6 CDS1 CXCL2 PLK4 DAPP1 FAM13A INTS12 PRDM8 PRKG2 ADH1C ANKRD50 SPATA5 PCDH18 ANXA5 SEC31A METAP1 PDE5A CXCL3 SMAD1 FRAS1 PPBP RASGEF1B UNC5C NDUFC1 NPNT SHROOM3 NUDT9 SETD7 CXCL9 GPRIN3 RNF150 SEC24D ABCG2 SGMS2 HADH HSD17B11 DKK2 PF4 NFKB1 CNOT6L EMCN TMEM150C TNIP3 RPL34 MAPK10 CXCL1 SCARB2
1,,CCNA2 TBCK GAR1 AP1AR WDFY3 RCHY1 HERC6 PGRMC2 ANKRD17 ALPK1 CAMK2D MGST2 BBS7 UBE2D3 TIFA CXCL5 ABCE1 ENPEP NAA15 ELF2 ADH1B SEC24B SDAD1 MMRN1 GYPE HERC3 ARSJ AIMP1 DNAJB14 CASP6 EIF4E LARP1B MRPL1 NAAA GSTCD PAQR3 NUP54 FGF2 USP38 FAT4 PRDM5 SPARCL1 MANBA BBS12 PKD2 PDLIM5 USP53 IL15 G3BP2 MTHFD2L
2,,SCLT1 PAPSS1 THAP6 HPSE RAB33B MAD2L1 CCNG2 HPGDS LIN54 ADH5 RAP1GDS1 COX18 C4orf36 KLHL8 STBD1 THAP9 USO1 TRAM1L1 COPS4 MFSD8 LEF1 TIGD2 HELQ COQ2 OTUD4 SMARCA5 METTL14 SYNPO2 SNCA PLA2G12A SCOC SCD5 MMAA ENOPH1 BMP2K OSTC SLC10A7 CISD2 ANAPC10 SMARCAD1 ELMOD2 CYP2U1
3,PPM1K BTC TET2,MRPS18C PRSS12 PPP3CA TET2 ZNF330 PPM1K INTU TSPAN5 TBC1D9 BTC PLAC8 AFF1 ELOVL6
4,PPA2,C4orf33 PPA2 CCNI LARP7 C4orf3
