Cluster,GWAS genes,Cluster genes
0,,SCLT1 PAPSS1 THAP6 ANTXR2 WDFY3 HPSE RCHY1 RAB33B BDH2 PDE5A CCNG2 PTPN13 LIN54 BBS7 EXOSC9 ADH5 RAP1GDS1 COX18 USO1 THAP9 KLHL8 RASGEF1B CDKL2 BANK1 COPS4 MFSD8 TIGD2 LEF1 HELQ COQ2 OTUD4 SDAD1 SMARCA5 METTL14 GPRIN3 HNRNPD SNCA PLA2G12A ABCG2 DNAJB14 SCOC GAB1 MMAA ENOPH1 BMP2K RASSF6 DKK2 DAPP1 NFKB1 MRPL1 CISD2 ANAPC10 PRDM8 SMARCAD1 PRDM5 ELMOD2 ADH1C ANKRD50 CXCL1 CYP2U1 IL15 G3BP2 SCARB2
1,PPM1K PPA2 FAM13A,TBCK AP1AR ZNF330 METAP1 HERC6 PGRMC2 ANKRD17 CXCL3 PPA2 ALPK1 HPGDS MGST2 C4orf3 UBE2D3 TIFA CXCL5 ABCE1 STBD1 NAA15 TRAM1L1 ELF2 AFF1 ZNF827 CXCL10 NUDT9 SETD7 GYPE HERC3 CXCL9 SYNPO2 ARSJ AIMP1 PPM1K ARHGAP24 SEC24D SGMS2 CASP6 EIF4E LARP1B NAAA FAM13A GSTCD PAQR3 PPP3CA NUP54 CCNI FGF2 USP38 FAT4 CXCL11 MANBA BBS12 PDLIM5 USP53 ANXA5 MTHFD2L
2,BTC NAP1L5 HHIP NPNT,CCNA2 SEC31A NAP1L5 C4orf33 SPRY1 INTU HSPA4L HHIP ELOVL6 PARM1 SMAD1 INPP4B PPBP SLC39A8 UNC5C NPNT SPP1 SHROOM3 MMRN1 PRSS12 RNF150 ANXA3 ANK2 PLAC8 SCD5 HSD17B11 PF4 BMP3 CDS1 LARP7 LSM6 PRKG2 SPARCL1 TBC1D9 BTC PKD2 MAPK10 SPATA5 PCDH18
3,TET2,GAR1 HERC5 HADH CXCL2 CNOT6L MRPS18C EMCN SLC10A7 INTS12 TET2 TMEM150C FRAS1 TSPAN5 RPL34 ADH1B NDUFC1
4,,MAML3 TNIP3 SEC24B CAMK2D OSTC C4orf36 CFI
