Cluster,GWAS genes,Cluster genes
0,NPNT FAM13A,C4orf33 TBCK SCLT1 ANTXR2 HPSE SPRY1 RCHY1 RAB33B BDH2 ANKRD17 PGRMC2 ALPK1 HPGDS MGST2 C4orf3 MTHFD2L BBS7 UBE2D3 USO1 ENPEP KLHL8 ELF2 CFI BANK1 COPS4 ZNF827 LEF1 NPNT COQ2 SHROOM3 SETD7 SYNPO2 RNF150 SNCA SCOC SGMS2 HSD17B11 EIF4E NFKB1 NAAA FAM13A LSM6 PAQR3 TMEM150C ANAPC10 NUP54 CCNI SMARCAD1 ELMOD2 TBC1D9 PKD2 PDLIM5 ANXA5 SCARB2
1,BTC HHIP,HERC5 ZNF330 PDE5A CCNG2 HHIP PTPN13 ELOVL6 PARM1 SMAD1 MAML3 FRAS1 ADH5 ABCE1 TRAM1L1 ADH1B HELQ USP53 MMRN1 GYPE METTL14 HERC3 ARSJ DNAJB14 GAB1 ABCG2 PCDH18 DKK2 LARP1B CDS1 MRPL1 GSTCD EMCN FGF2 FAT4 PRDM5 TSPAN5 BTC ANKRD50 CYP2U1
2,,GAR1 METAP1 INTU HSPA4L CXCL3 CAMK2D EXOSC9 RAP1GDS1 THAP9 NAA15 UNC5C CDKL2 MFSD8 NDUFC1 SEC24B PRSS12 SEC24D PLAC8 SCD5 MMAA ENOPH1 RASSF6 CXCL2 LARP7 OSTC CISD2 PRDM8 TNIP3 USP38 PRKG2 SPARCL1 ADH1C MANBA MAPK10 CXCL1 IL15
3,PPA2 TET2,CCNA2 PAPSS1 AP1AR MAD2L1 PPA2 TIFA TET2 INPP4B STBD1 RASGEF1B SLC39A8 TIGD2 SPP1 CXCL10 NUDT9 CXCL9 GPRIN3 AIMP1 ARHGAP24 ANXA3 PLA2G12A CASP6 BMP2K DAPP1 PLK4 CNOT6L SLC10A7 INTS12 RPL34 CXCL11 SPATA5 G3BP2
4,PPM1K NAP1L5,SMARCA5 SDAD1 MRPS18C NAP1L5 THAP6 PPP3CA WDFY3 PPM1K COX18 HERC6 ANK2 HADH AFF1 BBS12 LIN54 OTUD4
