Cluster,GWAS genes,Cluster genes
0,FAM13A HHIP BTC,ANK2 HHIP PRKG2 BMP3 CNOT6L SETD7 FRAS1 PPP3CA PRSS12 ABCG2 CDKL2 BTC TRAM1L1 ENOPH1 SYNPO2 RNF150 ARSJ LINC01088 AFF1 ADH1B TMEM150C SLC39A8 PKD2 FAM13A SPARCL1 HPGDS TSPAN5 PRDM5 RASSF6 PDE5A SPATA5 LIN54 GYPE SPP1 USO1 ANXA3 KLHL8 MTHFD2L FAM47E SHROOM3 JADE1 EMCN SMARCA5 FAM241A NDNF SOWAHB SCD5 BMP2K PAPSS1 SMAD1 METAP1 ELMOD2 TBCK GAB1 PLAC8 ANKRD50 UNC5C CDS1 AP1AR MMRN1 USP53
1,TET2 NPNT PPM1K,RPL34 SNHG8 TBC1D9 SNCA BLTP1 ABHD18 LINC02615 MFSD8 RAP1GDS1 NPNT SEPTIN7P14 HNRNPDL BBS12 SEPTIN11 OSTC EXOSC9 SEC24B FAM13A-AS1 CISD2 SMARCAD1 SCARB2 INTU GAR1 HSPA4L ELF2 SEC24D ANTXR2 PARM1 WDFY3-AS2 TET2 OTUD4 ALPK1 ADH5 PGRMC2 MAPK10 PPM1K THAP6 ABRAXAS1 ANXA5 SEC31A DKK2 DNAJB14 GTF2IP12 ADH1C IL15 ZGRF1 CYP2U1 THAP9 HNRNPD SCOC C4orf3 WDFY3 HADH CCNI USP38 LARP7 BDH2 THAP9-AS1 SCLT1 COPS4
2,PPA2 NAP1L5,HERC6 CASP6 CCNG2 LSM6 CXCL3 NAA15 HERC5 NUDT9 ELOVL6 INTS12 MRPL1 CXCL8 RASGEF1B ANKRD17 LARP1B LINC01094 CXCL1 FGF2 TIFA PYURF LAMTOR3 MGST2 MANBA CCNA2 GPRIN3 SDAD1 PCDH18 H2AZ1 COX18 C4orf33 CFI COQ2 RAB33B ZNF330 NAP1L5 G3BP2 ABCE1 ANAPC10 AREG CXCL2 NUP54 EIF4E MAD2L1 PLK4 UBE2D3 DAPP1 SGMS2 NDUFC1 HSD17B11 PPA2 NOCT PAQR3 TIGD2
3,,NAAA SLC9B2 STBD1 HPSE METTL14 MAML3 SPRY1 NFKB1 FAT4 PLA2G12A CXCL10 AIMP1 ARHGAP24 LINC01091 CXCL11 GPAT3 FLJ20021 CXCL9 TNIP3 NUDT6 LEF1 PDLIM5 MCUB BANK1 PRDM8 SEC24B-AS1
4,,ARHGEF38 PTPN13 GSTCD HHIP-AS1 CXCL5 INPP4B PF4 PPBP CAMK2D
