Cluster,GWAS genes,Cluster genes
0,NPNT HHIP FAM13A,CCNA2 C4orf33 SCLT1 WDFY3 SEC31A THAP6 HPSE METAP1 INTU HSPA4L MAD2L1 BDH2 ANKRD17 HHIP PTPN13 ALPK1 CAMK2D MGST2 PARM1 BBS7 INPP4B THAP9 C4orf36 CDKL2 UNC5C ZNF827 ADH1B MFSD8 SEC24B NPNT SPP1 CXCL10 NUDT9 METTL14 ARSJ RNF150 PLA2G12A RASSF6 DKK2 BMP3 LARP7 PLK4 MRPL1 FAM13A PAQR3 INTS12 CISD2 NUP54 SMARCAD1 PRDM5 ADH1C CXCL11 MAPK10 CXCL1 IL15 ANXA5 SCARB2
1,PPA2 NAP1L5,NAP1L5 ANTXR2 SPRY1 RAB33B PDE5A PGRMC2 PPA2 CCNG2 SMAD1 CXCL5 ADH5 PPBP STBD1 NAA15 CFI TRAM1L1 SLC39A8 COQ2 OTUD4 MMRN1 SETD7 SYNPO2 ANXA3 ABCG2 GAB1 SCOC ANK2 SGMS2 PCDH18 EIF4E PF4 LARP1B EMCN TMEM150C PRDM8 FGF2 FAT4 USP38 TSPAN5 PKD2 SPATA5 CYP2U1 MTHFD2L
2,PPM1K BTC,TBCK HERC5 ZNF330 RCHY1 HERC6 LIN54 EXOSC9 RAP1GDS1 USO1 KLHL8 COPS4 AFF1 NDUFC1 SHROOM3 SDAD1 SMARCA5 PRSS12 GPRIN3 AIMP1 PPM1K SEC24D DNAJB14 PLAC8 HADH SCD5 MMAA HSD17B11 BMP2K ENOPH1 OSTC CNOT6L LSM6 GSTCD ANAPC10 CCNI ELMOD2 TBC1D9 BTC USP53
3,TET2,GAR1 HERC3 SNCA CXCL3 CASP6 HPGDS CDS1 CXCL2 NFKB1 C4orf3 UBE2D3 MRPS18C TIFA SLC10A7 PPP3CA TET2 ABCE1 TNIP3 ELF2 RASGEF1B SPARCL1 MANBA ANKRD50 BBS12 PDLIM5 TIGD2 HELQ G3BP2
4,,RPL34 BANK1 MAML3 AP1AR FRAS1 DAPP1
