Cluster,GWAS genes,Cluster genes
0,NPNT HHIP FAM13A,INTU HSPA4L HHIP PTPN13 PARM1 INPP4B RAP1GDS1 ENPEP USO1 CDKL2 SLC39A8 ZNF827 ADH1B NDUFC1 NPNT OTUD4 SMARCA5 NUDT9 SETD7 SYNPO2 RNF150 SEC24D PLAC8 HADH HSD17B11 FAM13A TNIP3 FAT4 SPARCL1 TBC1D9 ADH1C ANKRD50 PKD2 PDLIM5 USP53 SCARB2
1,BTC,CCNA2 SEC31A PRSS12 AP1AR GPRIN3 METAP1 PLA2G12A MAD2L1 PGRMC2 ANKRD17 CAMK2D CDS1 BMP3 LIN54 DAPP1 OSTC MRPL1 PLK4 INTS12 PRDM8 COX18 FGF2 THAP9 USP38 RPL34 BTC MFSD8
2,,MMRN1 PAPSS1 HERC3 HPSE SPRY1 SNCA ANK2 RASSF6 HPGDS CXCL2 LARP1B MGST2 NFKB1 ELOVL6 C4orf3 TIFA PPP3CA CISD2 NAA15 ELF2 CFI TSPAN5 BANK1 MAPK10 CXCL1 HELQ
3,TET2,SDAD1 C4orf33 GAR1 SCLT1 WDFY3 ARSJ BDH2 CXCL3 DNAJB14 SGMS2 CCNG2 LARP7 UBE2D3 FRAS1 TET2 ADH5 KLHL8 STBD1 RASGEF1B MANBA BBS12 AFF1 TIGD2 PCDH18 SHROOM3 G3BP2
4,NAP1L5,NAP1L5 METTL14 ARHGAP24 ANXA3 SCOC GAB1 SCD5 MMAA ENOPH1 DKK2 CASP6 ALPK1 EIF4E CNOT6L BBS7 PAQR3 MRPS18C SLC10A7 ANAPC10 ABCE1 PRDM5 COPS4 SEC24B IL15
5,,GYPE CXCL9 RAB33B HERC6 ABCG2 PF4 NAAA SMAD1 CXCL5 PPBP C4orf36 TRAM1L1 PRKG2 ELMOD2 UNC5C CXCL11 SPATA5 SPP1 CXCL10
6,PPA2,TBCK ANTXR2 THAP6 HERC5 ZNF330 AIMP1 PDE5A PPA2 LSM6 EXOSC9 MAML3 EMCN TMEM150C NUP54 CCNI SMARCAD1 CYP2U1
7,PPM1K,GSTCD BMP2K PPM1K RCHY1 COQ2 ANXA5 MTHFD2L
